"School_Name","Address"
"CHIU LUT SAU MEMORIAL SECONDARY SCHOOL","7 TAI YUK ROAD YUEN LONG NEW TERRITORIES"
"NTHYK YUEN LONG DISTRICT SECONDARY SCH","123 KAU YUK ROAD YUEN LONG NEW TERRITORIES"
"TIN SHUI WAI GOVERNMENT SECONDARY SCHOOL","PHASE II TIN YIU ESTATE TIN SHUI WAI NEW TERRITORIES"
"YUEN LONG PUBLIC SECONDARY SCHOOL","22 TOWN PARK ROAD SOUTH SHUI NGAU LENG YUEN LONG NEW TERRITORIES"
"BETHEL HIGH SCHOOL","11, 4TH STREET, SECTION F FAIRVIEW PARK YUEN LONG NEW TERRITORIES"
"BUDDHIST MAU FUNG MEMORIAL COLLEGE","18 TIN PAK ROAD TIN SHUI WAI NEW TERRITORIES"
"CARITAS YL CHAN CHUN HA SEC SCH","66 SAI YU STREET YUEN LONG NEW TERRITORIES"
"CCC FONG YUN WAH SECONDARY SCHOOL","6 TIN YIP ROAD TIN SHUI WAI   YUEN LONG NEW TERRITORIES"
"CCC KEI LONG COLLEGE","8 FUNG YAU STREET SOUTH YUEN LONG NEW TERRITORIES"
"CCC KEI YUEN COLLEGE","FUNG YAU STREET EAST YUEN LONG NEW TERRITORIES"
"CUHKFAA THOMAS CHEUNG SECONDARY SCHOOL","TIN SHUI ESTATE TIN SHUI WAI, YUEN LONG NEW TERRITORIES"
"CUMBERLAND PRESBYTN CH YAO DAO SEC SCH","28 HONG YIP STREET YUEN LONG NEW TERRITORIES"
"ELCHK YL LUTHERAN SECONDARY SCHOOL","TIN YIU ESTATE TIN SHUI WAI , YUEN LONG NEW TERRITORIES"
"GERTRUDE SIMON LUTHERAN COLLEGE","1 TOWN PARK ROAD NORTH YUEN LONG NEW TERRITORIES"
"HKMA K S LO COLLEGE","26 TIN PAK ROAD TIN SHUI WAI, YUEN LONG NEW TERRITORIES"
"HO DAO COLL (SPONSORED BY SIK SIK YUEN)","11 HUNG SHUN ROAD YUEN LONG NEW TERRITORIES"
"JOCKEY CLUB MAN KWAN EDUYOUNG COLLEGE","5 TIN WING ROAD, TIN SHUI WAI NEW TERRITORIES"
"JU CHING CHU SEC SCH (YUEN LONG)","5 TIN WU ROAD TIN SHUI WAI, YUEN LONG NEW TERRITORIES"
"POH TANG PUI KING MEMORIAL COLLEGE","PHASE III   LONG PING ESTATE YUEN LONG NEW TERRITORIES"
"PUI SHING CATHOLIC SECONDARY SCHOOL","9 TIN HO ROAD TIN SHUI WAI , YUEN LONG NEW TERRITORIES"
"QES OLD STUDENTS' ASSOCIATION SEC SCH","18 TIN SHING ROAD TIN SHUI WAI, YUEN LONG NEW TERRITORIES"
"QESOSA TONG KWOK WAH SECONDARY SCHOOL","57 TIN WAH ROAD TIN SHUI WAI, YUEN LONG NEW TERRITORIES"
"SHUNG TAK CATHOLIC ENGLISH COLLEGE","1 HUNG TAK ROAD HUNG SHUI KIU, YUEN LONG NEW TERRITORIES"
"SKH BISHOP BAKER SECONDARY SCHOOL","FUNG YAU STREET SOUTH YUEN LONG NEW TERRITORIES"
"SPHRC KUNG YIK SHE SECONDARY SCHOOL","20 TIN SHING ROAD TIN SHUI WAI, YUEN LONG NEW TERRITORIES"
"STFA YUNG YAU COLLEGE","TIN HENG ESTATE TIN SHUI WAI, YUEN LONG NEW TERRITORIES"
"TIN SHUI WAI METHODIST COLLEGE","AREA 102, TIN SHUI WAI PHASE 4 (SECONDARY SCHOOL 1) YUEN LONG NEW TERRITORIES"
"TWGH CY MA MEMORIAL COLLEGE","YAU SHIN STREET AU TAU, YUEN LONG NEW TERRITORIES"
"TWGH KWOK YAT WAI COLLEGE","3 TSUI SING ROAD TIN SHUI WAI, YUEN LONG NEW TERRITORIES"
"TWGH LO KON TING MEMORIAL COLLEGE","PHASE III, LONG PING ESTATE YUEN LONG NEW TERRITORIES"
"TYYI MFBM NEI MING CHAN LCT MEM COLLEGE","TIN SHUI ESTATE PHASE I TIN SHUI WAI  YUEN LONG NEW TERRITORIES"
"YLPMSAA TANG SIU TONG SECONDARY SCHOOL","PING HA ROAD, AREA 3, TIN SHUI WAI YUEN LONG NEW TERRITORIES"
"YUEN LONG CATHOLIC SECONDARY SCHOOL","201 CASTLE PEAK ROAD PING SHAN YUEN LONG NEW TERRITORIES"
"YUEN LONG MERCHANTS ASSOCIATION SEC SCH","20 FUNG NIN ROAD YUEN LONG NEW TERRITORIES"
"CHINESE YMCA SECONDARY SCHOOL","TIN FU COURT AREA 102, TIN SHUI WAI PHASE 6 (SCHOOL 2) YUEN LONG NEW TERRITORIES"
"ELCHK LUTHERAN ACADEMY","25 LAM HAU TSUEN ROAD YUEN LONG NEW TERRITORIES"
"HEUNG TO MIDDLE SCHOOL (TIN SHUI WAI)","8 TIN FAI ROAD TIN SHUI WAI, YUEN LONG NEW TERRITORIES"
"HKFYG LEE SHAU KEE COLLEGE","12 TIN KWAI ROAD, TIN SHUI WAI YUEN LONG NEW TERRITORIES"
"MAN KWAN PAK KAU COLLEGE","51 TIN WAH ROAD TIN SHUI WAI   YUEN LONG NEW TERRITORIES"
"BEACON COLLEGE","G/F & 1 - 4/F, SHING SHUN BUILDING 41-43 CASTLE PEAK ROAD YUEN LONG NEW TERRITORIES"
"GERTRUDE SIMON LUTHERAN EVENING COLLEGE","1 TOWN PARK ROAD NORTH YUEN LONG NEW TERRITORIES"
"RUDOLF STEINER EDU FDN HK MARIA COLLEGE","ROOM 309, 311-312, 3/F. N.T. HEUNG YEE KUK YUEN LONG DISTRICT SECONDARY SCHOOL, 123 KAU YUK ROAD YUEN LONG NEW TERRITORIES"
"SOUTH YUEN LONG GOV PRI SCH","NO 21, LAM HAU TSUEN RD YUEN LONG NEW TERRITORIES"
"TIN SHUI WAI GOVERNMENT PRIMARY SCHOOL","10 TIN SHUI ROAD, TIN SHUI WAI YUEN LONG NEW TERRITORIES"
"YUEN LONG GOVERNMENT PRIMARY SCHOOL","AU TAU YUEN LONG NEW TERRITORIES"
"AD&FDPOHL LEUNG SING TAK SCHOOL","ESTATE PRIMARY SCHOOL LONG PING ESTATE, PHASE III YUEN LONG NEW TERRITORIES"
"BUDDHIST CHAN WING KAN MEMORIAL SCHOOL","23 LAM HAU TSUEN ROAD MA TIN, YUEN LONG NEW TERRITORIES"
"BUDDHIST WING YAN SCHOOL","6 FUNG YAU STREET SOUTH YUEN LONG NEW TERRITORIES"
"C & M ALLIANCE CHUI CHAK LAM MEM SCHOOL","KIN TAK STREET YUEN LONG NEW TERRITORIES"
"CCC CHUN KWONG PRIMARY SCHOOL","CHUNG SING PATH YUEN LONG NEW TERRITORIES"
"CHINESE YMCA PRIMARY SCHOOL","AREA 102 TIN SHUI WAI PHASE 4 (SCHOOL 2) YUEN LONG NEW TERRITORIES"
"CHIU YANG POR YEN PRIMARY SCHOOL","55 TIN WAH ROAD TIN SHUI WAI NEW TERRITORIES"
"CHIU YANG PRIMARY SCHOOL OF HONG KONG","TIN YIU ESTATE, PHASE III TIN SHUI WAI , YUEN LONG NEW TERRITORIES"
"CHRISTIAN ALLIANCE S Y YEH MEM PRI SCH","TIN CHAK ESTATE TIN SHUI WAI, YUEN LONG NEW TERRITORIES"
"CHRISTIAN PUI YAN PRIMARY SCHOOL","2 TIN YIP ROAD TIN SHUI WAI, YUEN LONG NEW TERRITORIES"
"CHUNG SING SCHOOL","29 KAU HUI ROAD YUEN LONG NEW TERRITORIES"
"CUMBERLAND PRESBY CHURCH YAO DAO PRI SCH","TIN FU COURT TIN SHUI WAI YUEN LONG NEW TERRITORIES"
"HK & MC LU CH WONG CHAN SOOK YING MEM SC","FAIRVIEW PARK D D 104   LOT 4665   ORCHID ROAD EAST TAI SHANG WAI  YUEN LONG NEW TERRITORIES"
"HKFYG LEE SHAU KEE PRIMARY SCHOOL","11 TIN WING ROAD TIN SHUI WAI YUEN LONG NEW TERRITORIES"
"HO MING PRI SCH SPSD BY SIK SIK YUEN","2 TIN PAK ROAD TIN SHUI WAI, YUEN LONG NEW TERRITORIES"
"KAM TIN MUNG YEUNG PUBLIC SCHOOL","KAM TIN YUEN LONG NEW TERRITORIES"
"KWONG MING SCHOOL","SHUI PIN WAI ESTATE YUEN LONG NEW TERRITORIES"
"KWONG MING YING LOI SCHOOL","12 YUEN CHING ROAD YUEN LONG NEW TERRITORIES"
"LIONS CLUBS INTL HO TAK SUM PRI SCH","AREA 3 (PS2) PHASE 4 TIN SHUI WAI YUEN LONG NEW TERRITORIES"
"LOK SIN TONG LEUNG KAU KUI PRI SCH","TIN SHUI ESTATE TIN SHUI WAI, YUEN  LONG NEW TERRITORIES"
"LST LEUNG KAU KUI PRIMARY SCHOOL (BR)","TIN YAN ESTATE TIN SHUI WAI, YUEN LONG NEW TERRITORIES"
"PAT HEUNG CENTRAL PRIMARY SCHOOL","199 LIN FA TEI KAM TIN PAT HEUNG, YUEN LONG NEW TERRITORIES"
"QES OLD STUDENTS' ASSN BRANCH PRI SCH","AREA 3, PHASE 4 TIN SHUI WAI YUEN LONG NEW TERRITORIES"
"QES OLD STUDENTS' ASSOCIATION PRI SCH","ESTATE PRIMARY SCHOOL TIN YIU ESTATE, PHASE I TIN SHUI WAI NEW TERRITORIES"
"SKH LING OI PRIMARY SCHOOL","15  MA MIU ROAD YUEN LONG NEW TERRITORIES"
"SKH ST JOSEPH'S PRIMARY SCHOOL","12 PO TEI ROAD KAM TIN, YUEN LONG NEW TERRITORIES"
"SKH TIN SHUI WAI LING OI PRIMARY SCHOOL","82 TIN SHUI ROAD TIN SHUI WAI, YUEN LONG NEW TERRITORIES"
"SPH RURAL COMMITTEE KUNG YIK SHE PRI SCH","AREA 27 TIN SHUI WAI, YUEN LONG NEW TERRITORIES"
"STFA WU MIEN TUEN PRIMARY SCHOOL","TIN HENG ESTATE, TIN SHUI WAI NEW TERRITORIES"
"TIN SHUI WAI CATHOLIC PRIMARY SCHOOL","28 TIN PAK ROAD TIN SHUI WAI, YUEN LONG NEW TERRITORIES"
"TIN SHUI WAI METHODIST PRIMARY SCHOOL","PHASE 1 AREA 31 TIN SHUI WAI NEW TERRITORIES"
"TUN YU SCHOOL","SAN TIN YUEN LONG NEW TERRITORIES"
"TUNG TAK SCHOOL","SHING MUN SAN TSUEN,  KAM TIN YUEN LONG NEW TERRITORIES"
"TWGH LEO TUNG-HAI LEE PRIMARY SCHOOL","19 TIN TAN STREET, TIN SHUI WAI YUEN LONG NEW TERRITORIES"
"TWGH YIU DAK CHI MEM PRI SCH (YUEN LONG)","TIN SHUI ESTATE TIN SHUI WAI NEW TERRITORIES"
"XIANGGANG PTH YANXISHE PRI SCH OF SC & C","AREA 102 TIN SHUI WAI PHASE 2 (PRIMARY SCHOOL 1) YUEN LONG NEW TERRITORIES"
"YL LONG PING ESTATE TUNG KOON PRI SCH","LONG PING ESTATE YUEN LONG NEW TERRITORIES"
"YL PUB MID SCH A A TANG YING YIP PRI SCH","86 TIN SHUI ROAD TIN SHUI WAI, YUEN LONG NEW TERRITORIES"
"YL PUB MID SCH ALUMNI ASSN PRI SCH","2 TOWN PARK ROAD NORTH YUEN LONG NEW TERRITORIES"
"YUEN LONG LONG PING ESTATE WAI CHOW SCH","PHASE II LONG PING ESTATE YUEN LONG NEW TERRITORIES"
"YUEN LONG MERCHANTS ASSN PRIMARY SCHOOL","244 CASTLE PEAK ROAD YUEN LONG NEW TERRITORIES"
"YUEN LONG PO KOK PRIMARY SCHOOL","55 TAN KWAI TSUEN ROAD HUNG SHUI KIU, YUEN LONG NEW TERRITORIES"
"W F JOSEPH LEE PRIMARY SCHOOL","9 TIN FAI ROAD TIN SHUI WAI, YUEN LONG NEW TERRITORIES"
"ANCHORS ACADEMY","1 KO PO PATH, KAM TIN NORTH YUEN LONG NEW TERRITORIES"
"ANFIELD ST. BOSCO KOON YING SCHOOL","D.D. 105 MAI PO SAN TSUEN, MAI PO YUEN LONG NEW TERRITORIES"
"ELCHK LUTHERAN SCHOOL","LOT3797 DD120 ON SHUN STREET YUEN LONG NEW TERRITORIES"
"GIGAMIND ENGLISH PRIMARY SCHOOL","BLOCK A MAYWOOD COURT, KINGSWOOD VILLAS 9 TIN LUNG ROAD TIN SHUI WAI, YUEN LONG NEW TERRITORIES"
"ZENITH ENGLISH PRIMARY SCHOOL","1/F, SHERWOOD COURT KINGSWOOD VILLAS LOT NO TSWTL 2 RP TIN SHUI WAI, YUEN LONG NEW TERRITORIES"
"BUDDHIST TCFS YEUNG YAT LAM MEMORIAL SCH","6 TIN PAK ROAD TIN SHUI WAI, YUEN LONG NEW TERRITORIES"
"CARITAS LOK KAN SCHOOL","17 TIN TAN STREET, TIN SHUI WAI NEW TERRITORIES"
"HONG CHI  MORNINGJOY SCHOOL, YUEN LONG","11 YUEN LONG TAI YUK ROAD YUEN LONG NEW TERRITORIES"
"HONG CHI MORNINGLIGHT SCHOOL, YUEN LONG","133 LYCHEE ROAD NORTH FAIRVIEW PARK, YUEN LONG NEW TERRITORIES"
"PLK LAW'S FOUNDATION SCHOOL","26 TOWN PARK ROAD SOUTH YUEN LONG NEW TERRITORIES"
"ABIDING KINDERGARTEN","G/F., NAM PIN WAI, LOT NO. 239, DD115 YUEN LONG NEW TERRITORIES"
"ACADEMY KINDERGARTEN (TIN SHUI WAI)","G/F, ANCILLARY FACILITIES BLOCK TIN CHUNG COURT TIN SHUI WAI NEW TERRITORIES"
"BAPTIST CHURCH SHINING GRACE KG","KINDERGARTEN NO 2, 3/F ANCILLARY FACILITIES BLOCK TIN WAH ESTATE, TIN SHUI WAI YUEN LONG NEW TERRITORIES"
"BUDDHIST CHI KWONG KINDERGARTEN","KINDERGARTEN NO. 2 AT 3/F. ANCILLARY FACILITIES BLOCK TIN YUET ESTATE TIN SHUI WAI NEW TERRITORIES"
"CASTAR KINDERGARTEN","KINDERGARTEN NO. 1, 3/F ANCILLARY FACILITIES BLOCK TIN WAH ESTATE, TIN SHUI WAI YUEN LONG NEW TERRITORIES"
"CHINESE YMCA KINDERGARTEN","KINDERGARTEN AT 2/F ANCILLARY FACILITIES BLOCK TIN YUET ESTATE TIN SHUI WAI NEW TERRITORIES"
"CHR ALLIANCE CHEN LEE WING TSING MEM KG","WING A & B, G/F, YIU CHEONG HOUSE TIN YIU ESTATE TIN SHUI WAI NEW TERRITORIES"
"CUHK FAA CHAN CHUN HA KINDERGARTEN","KINDERGARTEN NO 1, ROOF FLOOR TIN YAN SHOPPING CENTRE, TIN YAN ESTATE TIN SHUI WAI NEW TERRITORIES"
"CUHK FAA SHUN LUNG YAN CHAK KINDERGARTEN","2/F., ANCILLARY FACILITIES BLOCK TIN SHING COURT 3 TIN CHING STREET TIN SHUI WAI, YUEN LONG NEW TERRITORIES"
"EIS INTERNATIONAL PRE-SCHOOL","NO. 1, SAN WAI TSUEN, SAN TIN, YUEN LONG NEW TERRITORIES"
"ELITE KIDS ANGLO-CHINESE KINDERGARTEN","SHOP NO KG01, G/F, BLOCK A TIN LAI COURT TIN SHUI WAI, YUEN LONG NEW TERRITORIES"
"GUIDEPOSTS KG 3RD BR (TIN SHUI ESTATE)","G/F, BLOCK 11, SHUI LAM HOUSE TIN SHUI ESTATE, PHASE 4 TIN SHUI WAI, YUEN LONG NEW TERRITORIES"
"HHCKLA BUDDHIST LAM WONG MING WAI KG","G/F  WING B & C  TSZ SUM HOUSE TIN TSZ ESTATE TIN SHUI WAI NEW TERRITORIES"
"HO SHUI KG SPONSORED BY SIK SIK YUEN","G/F 
							SHUI SING HOUSE, (BLOCK 5) TIN SHUI ESTATE TIN SHUI WAI, YUEN LONG NEW TERRITORIES"
"JADE KINDERGARTEN","G/F, 153 SHUNG CHING SAN TSUEN TAI TONG ROAD, YUEN LONG NEW TERRITORIES"
"JING JING AC KG (HUNG SHUI KIU BR)","SHOPS 4, 5, 6, 10, 11 & 12, G/F LAI HUNG GARDEN 1 TAN KWAI TSUEN ROAD HUNG SHUI KIU, YUEN LONG NEW TERRITORIES"
"LONG PING ESTATE SING YAN KINDERGARTEN","G/F, BLOCK 10, FUNG PING HOUSE LONG PING ESTATE YUEN LONG NEW TERRITORIES"
"NT AOG CHURCH WAI YAN KINDERGARTEN","1/F 
							HING WONG HOUSE SAI CHING STREET   YLTL 285 YUEN LONG NEW TERRITORIES"
"PEACE EVANGELICAL CTR KG (TIN SHUI WAI)","G/F, ANCILLARY FACILITIES BLOCK TIN CHING ESTATE TIN SHUI WAI NEW TERRITORIES"
"PLK CHAN SENG YEE KINDERGARTEN","G/F, SHUI SHUM HOUSE (BLOCK 2) TIN SHUI ESTATE TIN SHUI WAI, YUEN LONG NEW TERRITORIES"
"PLK ELEANOR KWOK LAW KWAI CHUN KG","G/F., BLOCK 5, HUNG LONG HOUSE HUNG FUK ESTATE YUEN LONG NEW TERRITORIES"
"PRISTINE KINDERGARTEN","BLOCKS B, C & D, 1/F, WAH KIN BUILDING TAT FAI PATH YLTL 375, YUEN LONG NEW TERRITORIES"
"REGENT'S KINDERGARTEN (BRANCH SCHOOL)","1/F 
							SHOP NOS. 5B, 6, 7, 8 & 9, 1/F. PEARL HOUSE ON LOK ROAD YUEN LONG NEW TERRITORIES"
"SAGARMATHA KINDERGARTEN","FLAT A ,B, C & F, 2/F LEN SHING MANSION 162-168 CASTLE PEAK ROAD YUEN LONG NEW TERRITORIES"
"SKH ST JOSEPH'S CHURCH KINDERGARTEN","83A NG KA TSUEN PAT HEUNG, YUEN LONG NEW TERRITORIES"
"ST LORRAINE KINDERGARTEN (YUEN LONG)","15 SAI CHING STREET YUEN LONG NEW TERRITORIES"
"ST MATTHIAS' CHURCH CHIU CHUN KG","G-2/F 
							9 MA MIU ROAD YUEN LONG NEW TERRITORIES"
"ST. JEROME'S CATHOLIC KINDERGARTEN","2/F AND 3/F 6 TIN MEI STREET TIN SHUI WAI, YUEN LONG NEW TERRITORIES"
"SUN ISLAND ENGLISH KG (YUEN LONG BRANCH)","SHOP L3, LEVEL 3 YOHO MALL II 8 LONG YAT ROAD YUEN LONG NEW TERRITORIES"
"TAI PO BAPTIST KG TIN CHAK ESTATE BRANCH","G/F, CHAK SING HOUSE TIN CHAK ESTATE TIN SHUI WAI, YUEN LONG NEW TERRITORIES"
"TIN SHUI WAI ALLIANCE KINDERGARTEN","G/F, WING B & C, HENG FU HOUSE BLOCK 3, TIN HENG ESTATE TIN SHUI WAI, YUEN LONG NEW TERRITORIES"
"TSING YI TRADE ASSN TIN SHUI WAI KG","KINDERGARTEN NO 3 AT 3/F ANCILLARY FACILITIES BLOCK TIN YUET ESTATE TIN SHUI WAI NEW TERRITORIES"
"TWGH WONG CHU WAI FUN KINDERGARTEN","G/F 
							YIU HONG HOUSE TIN YIU ESTATE TIN SHUI WAI YUEN LONG NEW TERRITORIES"
"YAN CHAI HOSPITAL MING TAK KINDERGARTEN","G/F, WING B & C, HENG KIN HOUSE BLOCK 1, TIN HENG ESTATE TIN SHUI WAI, YUEN LONG, N.T. (KINDERGARTEN) NEW TERRITORIES"
"YL CHURCH (CCC) CHAN KWONG NO. 2 KG","NO 9 PING SHUN STREET YUEN LONG NEW TERRITORIES"
"YL P M S A A LAU LEUNG SHEUNG MEM K/G","WINGS A & B, G/F, YIU CHAK HOUSE TIN YIU ESTATE TIN SHUI WAI, YUEN LONG NEW TERRITORIES"
"YL TUNG KOON DIST ASSN HUNG TING KA KG","KINDERGARTEN NO 2, ROOF FLOOR TIN YAN SHOPPING CENTRE, TIN YAN ESTATE TIN SHUI WAI NEW TERRITORIES"
"YLC(CCC) LONG PING ESTATE CHAN KWONG KG","G/F 
							HAY PING HOUSE LONG PING ESTATE YUEN LONG NEW TERRITORIES"
"YUEN KONG KINDERGARTEN","YUEN KONG VILLAGE KAM SHEUNG ROAD PAT HEUNG, YUEN LONG NEW TERRITORIES"
"YUEN LONG CHURCH (CCC) CHAN KWONG KG","5-7 PING SHUN STREET YUEN LONG NEW TERRITORIES"
"YUEN LONG LUTHERAN LIFE KINDERGARTEN","LOTS 3713 & 3714 IN D.D. 120 ON SHUN STREET YUEN LONG"
"YUEN LONG MERCHANTS ASSOCIATION KG","WINGS A & B, G/F, YIU HING HOUSE TIN YIU ESTATE TIN SHUI WAI NEW TERRITORIES"
"YUEN LONG SAM YUK KINDERGARTEN","265 - 267 CASTLE PEAK ROAD YUEN LONG YUEN LONG NEW TERRITORIES"
"AGNES KINDERGARTEN (GRANDEUR TERRACE)","KINDERGARTEN OF GRANDEUR TERRACE TIN SHUI WAI   YUEN LONG NEW TERRITORIES"
"AGNES WISE KINDERGARTEN","G/F & 1/F, KINDERGARTEN, UPTOWN 600 CASTLE PEAK ROAD HUNG SHUI KIU, YUEN LONG NEW TERRITORIES"
"ANCHORS ACADEMY AFFILIATED INT KG","2/F., ACADEMIC BLOCK 1 KO PO PATH KAM TIN NORTH YUEN LONG NEW TERRITORIES"
"C & MA TIN CHUNG NURSERY SCH","1/F 
							TIN CHUNG COURT ANCILLARY FACILITIES BLK TIN CHUNG COURT TIN SHUI WAI NEW TERRITORIES"
"C&MA FAIRVIEW PARK KINDERGARTEN","1/F BLK D & E 
							TOWN CENTRE FAIRVIEW PARK YUEN LONG NEW TERRITORIES"
"CECES ORGANIZED AETNA PRESCHOOL","G/F, ANNEX BLOCK TIN SHING SHOPPING CENTRE TIN SHING COURT TIN SHUI WAI NEW TERRITORIES"
"EFCC - TIN YAN NURSERY SCHOOL","SHOP 122, 1/F TIN YAN SHOPPING CENTRE TIN YAN ESTATE TIN SHUI WAI NEW TERRITORIES"
"FIRST AOG CHURCH TIN CHAK NURSERY","G/F 
							WING B & C, CHAK SUN HOUSE TIN CHAK ESTATE TIN SHUI WAI NEW TERRITORIES"
"GIGAMIND KINDERGARTEN","BLOCK B, MAYWOOD COURT KINGSWOOD VILLAS 9 TIN LUNG ROAD TIN SHUI WAI NEW TERRITORIES"
"HKCS TIN HENG NURSERY SCHOOL","G/F, WING B&C, HENG KWAI HOUSE TIN HENG ESTATE TIN SHUI WAI NEW TERRITORIES"
"HKSKH HA SUI WAN NURSERY SCHOOL","G/F 4 TIN LUNG ROAD TIN SHUI WAI  YUEN LONG NEW TERRITORIES"
"JOYFUL WORLD INTERNATIONAL KG(YUEN LONG)","1/F., LIN FAT BUILDING 2 FUNG KWAN STREET YUEN LONG NEW TERRITORIES"
"KARLAM ANGLO-CHINESE KINDERGARTEN","G/F - 3/F 59 ON NING ROAD YUEN LONG NEW TERRITORIES"
"MCC LITTLE ANGEL (TIN SHING) K/G","1/F 
							ANNEX BLOCK, TIN SHING SHOPPING CENTRE TIN SHUI WAI NEW TERRITORIES"
"NAAC YUEN LONG DAY NURSERY","G/F (ENTRANCE) & 1/F ORION COURT 23 MAU TAN STREET YUEN LONG NEW TERRITORIES"
"NTW&JWA L YUEN LONG NURSERY SCHOOL","4/F 
							YUEN LONG TOWN HALL 4 TAI YUK ROAD YUEN LONG NEW TERRITORIES"
"PO LEUNG KUK LIU SEW HAR KINDERGARTEN","SHOP 1-8, G/F 44 SHUI CHE KWUN STREET YUEN LONG NEW TERRITORIES"
"POH CHAN POON PUI CHING MEMORIAL KG","G/F, BLOCK 9, HOR PING HOUSE LONG PING ESTATE YUEN LONG NEW TERRITORIES"
"POH MRS. CHU KWOK KING MEMORIAL KG","G/F, WING B & C, SHUI MOON HOUSE TIN SHUI ESTATE TIN SHUI WAI YUEN LONG NEW TERRITORIES"
"SA KAM TIN NURSERY SCH","G/F 
							103 KAM TIN ROAD YUEN LONG NEW TERRITORIES"
"ST LORRAINE ENGLISH KINDERGARTEN","RM G1 G/F 
							PALM SPRINGS COMMERCIAL CENTRE WO SHANG WAI YUEN LONG NEW TERRITORIES"
"ST MATTHIAS' CHURCH NURSERY SCHOOL","NO.15-20, G/F,  WOO SHUI HOUSE SHUI PIN WAI ESTATE YUEN LONG NEW TERRITORIES"
"TALENT KINDERGARTEN","KINDERGARTEN PREMISES, KENSWOOD COURT, KINGSWOOD VILLAS, 2 TIN LUNG ROAD, TIN SHUI WAI, YUEN LONG NEW TERRITORIES"
"TOPKIDS INTERNATIONAL KINDERGARTEN (YL)","G/F (PART OF) & 1/F., SHING FAT BUILDING 14 YUEN LONG TAI CHEUNG STREET YUEN LONG NEW TERRITORIES"
"TUTOR TIME INTERNATIONAL KG (YOHO)","SHOP G011 GROUND LEVEL AND MEZZANINE LEVEL YOHO MALL I, NO. 9 YUEN LUNG STREET YUEN LONG NEW TERRITORIES"
"TWGHS  ZONTA CLUB OF KOWLOON NURSERY SCH","1/F 
							ANCILLARY FACILITIES BLOCK TIN YUET ESTATE TIN SHUI WAI NEW TERRITORIES"
"YAN CHAI HOSPITAL NINA LAM KINDERGARTEN","G/F, YAN CHAI HOSPITAL 24TH TERM BOARD OF DIRECTORS SOCIAL SERVICES CENTRE 6 TIN HO ROAD TIN SHUI WAI YUEN LONG NEW TERRITORIES"
"YAN OI TONG NG WONG FUNG YING KG","5/F 
							TIN YIU COMMUNITY CENTRE TIN YIU ESTATE TIN SHUI WAI,  YUEN LONG HONG KONG"
"YL CHURCH CCC CHOW SUNG CHU OI NUR SCH","5 PING SHUN STREET YUEN LONG NEW TERRITORIES"
"YORK INTERNATIONAL PRE-SCHOOL (WETLAND)","SHOP KINDERGARTEN, G/F. WETLAND SEASONS BAY SHOPPING ARCADE 1 WETLAND PARK ROAD TIN SHUI WAI NEW TERRITORIES"
"YORK MONTESSORI INTL PRE-SCHOOL (YL)","KINDERGARTEN PREMISES, G/F. COMMERCIAL ACCOMMODATION NO. 18 CASTLE PEAK ROAD TAM MI, KAM TIN, YUEN LONG NEW TERRITORIES"
"YUEN LONG RHENISH NURSERY","RM 111 1/F 
							TIN YIU PLAZA TIN YIU ESTATE TIN SHUI WAI, YUEN LONG NEW TERRITORIES"
"YUEN YUEN KINDERGARTEN (TIN YAT ESTATE)","G/F, CARPARK BLOCK TIN YAT ESTATE TIN SHUI WAI NEW TERRITORIES"
"ZENITH KINDERGARTEN (SHERWOOD)","G/F., SHERWOOD COURT, KINGSWOOD VILLAS LOT NO. TSWTL 2 RP, TIN SHUI WAI YUEN LONG NEW TERRITORIES"
"A SMART EDUCATION CENTER","SHOP L124, 1/F., TIN YIU PLAZA TIN YIU ESTATE 2 TIN WU ROAD TIN SHUI WAI, YUEN LONG NEW TERRITORIES"
"ACADEMY OF GOODWILL EDUCATION CENTRE","SHOP 17, G/F., YEE FUNG GARDEN 38 MA TIN ROAD YUEN LONG NEW TERRITORIES"
"ACCESS TUTORIAL CTR (YEE FUNG)","SHOP NO 60, G/F, YEE FUNG GARDEN 38 MA TIN ROAD YUEN LONG NEW TERRITORIES"
"ACHIEVEMENT EDUCATIONAL CENTER (YL)","NO. 8, 3/F, KWONG WAH PLAZA 11 TAI TONG ROAD YUEN LONG NEW TERRITORIES"
"ACHIEVER EDUCATION CTR","ROOM 404 - 405, 4/F. & ROOM 809, 8/F. KWONG WAH PLAZA 11 TAI TONG ROAD YUEN LONG NEW TERRITORIES"
"ADVANCED AND ENJOYABLE EDUCATION CENTRE","SHOP 5, 1/F. YUK LUNG MANSION 18 FUNG KAM STREET YUEN LONG NEW TERRITORIES"
"ALAN CHAN EDU CENTRE (3RD BRANCH)","ROOMS 702, 703, 704 & 706 7/F YUEN LONG CENTRE 55 SAU FU STREET YUEN LONG NEW TERRITORIES"
"APEX EDUCATION CENTRE (TIN SHUI WAI)","SHOP 106, 1/F., TIN TSZ SHOPPING CENTRE TIN TSZ ESTATE 9 TIN HEI STREET TIN SHUI WAI, YUEN LONG NEW TERRITORIES"
"BABINGTON EDUCATION CENTRE (YUEN LONG)","SHOP 28, G/F., SHUN FUNG BUILDING 5 - 7 FUNG YAU STREET NORTH YUEN LONG NEW TERRITORIES"
"BABINGTON EDUCATION CTR (TIN SHUI WAI)","SHOP 152A, 1/F., +WOO PHASE 1 12 - 18 TIN YAN ROAD TIN SHUI WAI NEW TERRITORIES"
"BE TOP EDUCATION CENTRE","ROOM 8, 5/F, KWONG WAH PLAZA 11 TAI TONG ROAD YUEN LONG NEW TERRITORIES"
"BEACON (EVENING) COLLEGE","G/F & 1 - 4/F, SHING SHUN BUILDING 41-43 CASTLE PEAK ROAD YUEN LONG NEW TERRITORIES"
"BIG UNIVERSE EDUCATION CENTER","SHOP 1B, G/F. ANCILLARY FACILITIES BLOCK TIN WAH ESTATE TIN SHUI WAI NEW TERRITORIES"
"BLESSING CHILD EDU CTR(YUEN LONG)","ROOMS 10 & 11, 5/F. TOWER 1, ONE NORTH 8 HONG YIP STREET YUEN LONG NEW TERRITORIES"
"BRIGHT ENGLISH EDU CENTRE (TIN SHU WAI)","SHOP 3086, 3/F. ONE SKY MALL 8 TIN SAU ROAD TIN SHUI WAI NEW TERRITORIES"
"BRIGHT ENGLISH EDU CTR (TSW SOUTH)","SHOP 187 1/F., +WOO PHASE 1 12-18 TIN YAN ROAD TIN SHUI WAI NEW TERRITORIES"
"BRIGHT ENGLISH EDUCATION CENTRE (YL)","ROOM 407 & 410, 4/F. YUEN LONG CENTRE 55 SAU FU STREET YUEN LONG NEW TERRITORIES"
"BRILLIANT SUNSHINE EDUCATION CENTRE","ROOMS 507, KWONG WAH PLAZA 11 TAI TONG ROAD YUEN LONG NEW TERRITORIES"
"BUTTERFLY MILK CREATIVE ENGLISH SCH (YL)","UNIT 501, 5/F., THE RAINBOW 22 WANG YIP STREET SOUTH YUEN LONG NEW TERRITORIES"
"CARITAS INST OF COMMUNITY EDUCATION - YL","NO 1, G/F, DIP SHUI HOUSE AND NO 2, G/F SAN SHUI HOUSE, SHUI PIN WAI ESTATE YUEN LONG NEW TERRITORIES"
"CH OF UNITED BRETHREN IN CHRIST YL TUT C","FLAT 206-209, PODIUM, YING SHUI HOUSE SHUI PIN WAI ESTATE YUEN LONG NEW TERRITORIES"
"CHARLES DARWIN EDUCATION CENTRE","ROOM 603, KWONG WAH PLAZA 11 TAI TONG ROAD YUEN LONG NEW TERRITORIES"
"CHIEFLIST EDUCATION CENTRE","SHOP NO 6, G/F, CHESTWOOD COURT KINGSWOOD VILLAS NO 8 TIN SHUI ROAD TIN SHUI WAI, YUEN LONG NEW TERRITORIES"
"CHIEFLIST EDUCATION CENTRE (EVE SCHOOL)","SHOP NO 6, G/F, CHESTWOOD COURT KINGSWOOD VILLAS NO 8 TIN SHUI ROAD TIN SHUI WAI, YUEN LONG NEW TERRITORIES"
"CHIEFLIST EDUCATION CENTRE (YL CENTRE)","ROOM 308 & 310, 3/F, YUEN LONG CENTRE 55 SAU FU STREET YUEN LONG NEW TERRITORIES"
"CHR & MIS ALLI YUEN KEI FORRADER EDU CTR","2/F., HONG LOK SQUARE NO. 8 YUEN LONG HONG LOK ROAD YUEN LONG NEW TERRITORIES"
"CUILIN EDUCATION CENTRE","G/F., 103 KO PO TSUEN KAM TIN, YUEN LONG NEW TERRITORIES"
"DIRECTING EDU CTR (ONE SKY 1106)","SHOP 1106, 1/F. ONE SKY MALL 8 TIN SAU ROAD TIN SHUI WAI NEW TERRITORIES"
"DIRECTING EDUCATION CENTRE (ONE SKY)","SHOP 1026, 1/F. ONE SKY MALL 8 TIN SAU ROAD TIN SHUI WAI NEW TERRITORIES"
"DIRECTING EDUCATION CENTRE (TIN CHING)","SHOP 3, G/F. CHING CHOI HOUSE, TIN CHING ESTATE TIN SHUI WAI NEW TERRITORIES"
"DOMINANT EDUCATION CENTRE","SHOP 1109, 1/F. ONE SKY MALL, 8 TIN SAU ROAD TIN SHUI WAI NEW TERRITORIES"
"DONUT RAINBOW EDUCATION CENTRE","SHOP A, G/F., PARK SIGNATURE 68 KUNG UM ROAD YUEN LONG NEW TERRITORIES"
"DR. SMARTIES EDUCATION CENTRE","ROOM 605, 6/F, YUEN LONG CENTRE 55 SAU FU STREET YUEN LONG NEW TERRITORIES"
"E.NOPI PURPLE TREE EDUCATION CENTRE","SHOP 188, 1/F, PHASE 1, KINGSWOOD GINZA TIN SHUI WAI NEW TERRITORIES"
"EASY CREATIVE LEARNING CENTRE","SHOP NO 57, G/F, YEE FUNG GARDEN 38 MA TIN ROAD YUEN LONG NEW TERRITORIES"
"EASY MATHS EDUCATION CENTRE","OFFICES 05 - 07, 4/F. YUEN LONG COMMERCIAL CENTRE 18 - 24 KAU YUK ROAD YUEN LONG NEW TERRITORIES"
"EASY TO TRAIN EDUCATION CENTRE","SHOP 2103, 2/F. ONE SKY MALL 8 TIN SAU ROAD TIN SHUI WAI NEW TERRITORIES"
"EDUWHIZ LEARNING CENTRE","SHOP 215, 2/F., TIN CHAK SHOPPING CENTRE TIN CHAK ESTATE 71, 73, 75 & 77 TIN SHUI ROAD TIN SHUI WAI, YUEN LONG NEW TERRITORIES"
"EGLC MUTUAL LOVING TUTORIAL CENTRE (YL)","SHOP NO 13, G/F, SPRINGDALE VILLAS 80 MA TIN ROAD YUEN LONG NEW TERRITORIES"
"ELCHK LIGHT EDUCATIONAL CENTRE","UNITS A-E   3/F YAT SUN BUILDING NO.5 YAT SAN STREET YUEN LONG NEW TERRITORIES"
"ELITE ACADEMY EDUCATION CENTRE","UNIT 309, 3/F, YUEN LONG CENTRE 55 SAU FU STREET YUEN LONG NEW TERRITORIES"
"ELITE GROUP EDUCATION CENTRE (TSW)","SHOP 189 & 191, 1/F. PHASE 1 FORTUNE KINGSWOOD 12 - 18 TIN YAN ROAD TIN SHUI WAI, YUEN LONG NEW TERRITORIES"
"ENDEAVOUR EXCELLENT EDUCATION CENTRE","SHOP NO 2, G/F, LUEN FAT HOUSE 11-13 MA WANG ROAD & 14-48 PING CHEONG PATH YUEN LONG NEW TERRITORIES"
"ENJOY LEARNING CENTRE","SHOP 27, G/F., HO SHUN KING BUILDING 3 FUNG YAU STREET SOUTH YUEN LONG NEW TERRITORIES"
"EVERGREEN WAY EDU CENTRE (PARK YOHO)","SHOP 203, 1/F. PARK CIRCLE 18 CASTLE PEAK ROAD, TAM MI YUEN LONG NEW TERRITORIES"
"EYE CULTURE EDUCATION CENTRE","G/F. 66 LUNG TIN TSUEN YUEN LONG NEW TERRITORIES"
"EYE LEVEL BRIGHT KIDZ EDUCATION CENTRE","SHOP 70, G/F., YEE FUNG GARDEN 38 MA TIN ROAD YUEN LONG NEW TERRITORIES"
"EYE LEVEL WONDERLAND EDUCATION CTR (YL)","SHOP 38, G/F., SHUN FUNG BUILDING 5 - 7 FUNG YAU STREET NORTH YUEN LONG NEW TERRITORIES"
"FAST & FUN ENGLISH CENTRE","ROOMS 708 - 710, 7/F., YUEN LONG CENTRE 55 SAU FU STREET YUEN LONG NEW TERRITORIES"
"FUNG SKY WING ONE EDUCATION CENTRE","SHOP 3075, 3/F., ONE SKY MALL 8 TIN SAU ROAD, TIN SHUI WAI NEW TERRITORIES"
"FUNG WING EDU CTR (PROSPER CTR SHOP 02)","SHOP 02, 1/F. PROSPER CENTRE 29 SAU FU STREET YUEN LONG NEW TERRITORIES"
"FUNG WING EDU CTR (PROSPER CTR SHOP 18)","SHOP 18, 1/F. PROSPER CENTRE 29 SAU FU STREET YUEN LONG NEW TERRITORIES"
"FUNG WING EDU CTR (PROSPER CTR SHOP 19)","SHOP 19, 1/F. PROSPER CENTRE 29 SAU FU STREET YUEN LONG NEW TERRITORIES"
"FUNG WING EDU CTR (TIN CHAK SHOP 113C)","SHOP 113C 1/F.,"
"FUNG WING EDU CTR (TIN CHAK SHOP 225)","SHOP 225, 2/F., TIN CHAK SHOPPING CENTRE TIN CHAK ESTATE 71, 73, 75 & 77 TIN SHUI ROAD TIN SHUI WAI, YUEN LONG NEW TERRITORIES"
"FUNG WING EDU CTR(YL CENTRE SHOP 403)","FLAT 403, 4/F. YUEN LONG CENTRE 55 SAU FU STREET YUEN LONG NEW TERRITORIES"
"FUNG WING EDU CTR(YL CTR SHOP 604)","ROOM 604, 6/F., YUEN LONG CENTRE 55 SAU FU STREET YUEN LONG NEW TERRITORIES"
"FUNNY EDUCATION CENTRE","SHOP A65 & A123 G/F, KINGSWOOD RICHLY PLAZA 1 TIN WU ROAD TIN SHUI WAI, YUEN LONG NEW TERRITORIES"
"FUNNY PLACE EDUCATION CENTER","SHOP 31, G/F., HO SHUN LEE BUILDING 9 FUNG YAU STREET SOUTH YUEN LONG NEW TERRITORIES"
"GALAXY ELITE LEARNING CENTRE","SHOPS 44, 46, 48 & 52, G/F HO SHUN LEE BUILDING 9 FUNG YAU STREET SOUTH YUEN LONG NEW TERRITORIES"
"GLOBAL POSITIONING SYSTEM EDU CENTRE","SHOP 31 & 32, G/F HO SHUN YEE BUILDING 9 FUNG YAU STREET EAST YUEN LONG NEW TERRITORIES"
"GRACE PARADISO LEARNING CENTRE","SHOP 3, G/F., HO YUET BUILDING 5 ON LEUNG LANE YUEN LONG NEW TERRITORIES"
